{
  "$schema": "./schema/layout.schema.json",
  "templateId": "la-peptides-universal-label",
  "templateVersion": "2.1.0",
  "sourceFile": "./master-label.svg",
  "description": "Percentage-based coordinates for every editable region in master-label.svg, so a web application, the sales app, or a backend tool can position an overlay/editor or recompute pixel positions at any render resolution without parsing the SVG or redesigning the label. Every region's \"id\" is identical to its SVG element id and to its fieldKey in label-spec.json.",
  "canvas": {
    "widthPt": 127.44,
    "heightPt": 55.44,
    "widthPx300dpi": 531,
    "heightPx300dpi": 231,
    "aspectRatio": 2.2987
  },
  "coordinateSystem": {
    "origin": "top-left",
    "unit": "percent",
    "xAxis": "percent of canvas width (0-100)",
    "yAxis": "percent of canvas height (0-100)",
    "widthAxis": "percent of canvas width (0-100)",
    "heightAxis": "percent of canvas height (0-100)",
    "note": "width%/height% are computed against DIFFERENT absolute axes (canvas width vs. canvas height respectively), matching how CSS percentage sizing works on a fixed-aspect-ratio box. Because the canvas itself is not square (127.44 x 55.44pt), a square element's width% and height% are NOT equal (e.g. coa_qr is 18x18pt but reports width=14.124%, height=32.468%). This is correct: render the canvas at its true aspect ratio (any size proportional to 127.44:55.44, e.g. 531x231px) and converting each percentage back with widthPx = widthPct/100*canvasWidthPx, heightPx = heightPct/100*canvasHeightPx reproduces the exact original square. Do not derive a single 'scale factor' from width alone and apply it to height, or vice versa.",
    "textRegions": "For type=\"text\" regions, x/y/width/height describe the ALLOTTED box the field is safe to fill (matches the maxLength budget in label-spec.json's \"fields\"), not the as-drawn bounding box of the current placeholder string. baselineYPct is the SVG text baseline position (percent of canvas height) if you need to render actual SVG <text> rather than an HTML box. textAnchor \"middle\" means the field's text is horizontally centered within the region rather than left-aligned from x."
  },
  "layers": [
    {
      "id": "background_layer",
      "label": "Background Layer"
    },
    {
      "id": "brand_layer",
      "label": "Left Branding Layer"
    },
    {
      "id": "divider_layer",
      "label": "Divider Layer"
    },
    {
      "id": "product_layer",
      "label": "Product Layer"
    },
    {
      "id": "verification_layer",
      "label": "Verification Layer"
    }
  ],
  "regions": [
    {
      "id": "background",
      "layer": "background_layer",
      "type": "shape",
      "x": 0,
      "y": 0,
      "width": 100,
      "height": 100,
      "locked": true,
      "defaultPlaceholder": null,
      "alignment": null,
      "autoFit": {
        "enabled": false
      }
    },
    {
      "id": "border",
      "layer": "background_layer",
      "type": "shape",
      "x": 1.177,
      "y": 2.706,
      "width": 97.646,
      "height": 94.589,
      "locked": true,
      "defaultPlaceholder": null,
      "alignment": null,
      "autoFit": {
        "enabled": false
      }
    },
    {
      "id": "divider_left",
      "layer": "divider_layer",
      "type": "shape",
      "x": 32.957,
      "y": 10.823,
      "width": 0.471,
      "height": 78.463,
      "locked": true,
      "defaultPlaceholder": null,
      "alignment": null,
      "autoFit": {
        "enabled": false
      }
    },
    {
      "id": "divider_right",
      "layer": "divider_layer",
      "type": "shape",
      "x": 69.052,
      "y": 10.823,
      "width": 0.471,
      "height": 78.463,
      "locked": true,
      "defaultPlaceholder": null,
      "alignment": null,
      "autoFit": {
        "enabled": false
      }
    },
    {
      "id": "brand_logo",
      "layer": "brand_layer",
      "type": "image",
      "x": 4.708,
      "y": 10.823,
      "width": 10.201,
      "height": 23.449,
      "locked": false,
      "defaultPlaceholder": "placeholder-logo.svg",
      "alignment": null,
      "autoFit": {
        "enabled": false
      }
    },
    {
      "id": "brand_logo_secondary",
      "layer": "brand_layer",
      "type": "use",
      "x": 16.871,
      "y": 13.528,
      "width": 6.277,
      "height": 14.43,
      "locked": false,
      "defaultPlaceholder": "#icon-logo-secondary",
      "alignment": null,
      "autoFit": {
        "enabled": false
      }
    },
    {
      "id": "brand_name",
      "layer": "brand_layer",
      "type": "text",
      "x": 4.708,
      "y": 39.394,
      "width": 26.679,
      "height": 10.786,
      "baselineYPct": 46.898,
      "textAnchor": "start",
      "locked": false,
      "defaultPlaceholder": "BRAND NAME",
      "alignment": "left",
      "autoFit": {
        "enabled": true,
        "baseFontSizePt": 5.2,
        "minFontSizePt": 3.2
      }
    },
    {
      "id": "brand_subtitle",
      "layer": "brand_layer",
      "type": "text",
      "x": 4.708,
      "y": 51.154,
      "width": 26.679,
      "height": 6.854,
      "baselineYPct": 55.916,
      "textAnchor": "start",
      "locked": false,
      "defaultPlaceholder": "BRAND SUBTITLE",
      "alignment": "left",
      "autoFit": {
        "enabled": false
      }
    },
    {
      "id": "brand_decorative_graphic",
      "layer": "brand_layer",
      "type": "use",
      "x": 4.708,
      "y": 60.606,
      "width": 2.511,
      "height": 5.772,
      "locked": false,
      "defaultPlaceholder": "#icon-decorative",
      "alignment": null,
      "autoFit": {
        "enabled": false
      }
    },
    {
      "id": "brand_tagline",
      "layer": "brand_layer",
      "type": "text",
      "x": 8.318,
      "y": 61.688,
      "width": 23.07,
      "height": 6.223,
      "baselineYPct": 66.017,
      "textAnchor": "start",
      "locked": false,
      "defaultPlaceholder": "BRAND TAGLINE",
      "alignment": "left",
      "autoFit": {
        "enabled": true,
        "baseFontSizePt": 3,
        "minFontSizePt": 2.2
      }
    },
    {
      "id": "product_name",
      "layer": "product_layer",
      "type": "text",
      "x": 36.095,
      "y": 22.547,
      "width": 31.387,
      "height": 10.372,
      "baselineYPct": 29.762,
      "textAnchor": "start",
      "locked": false,
      "defaultPlaceholder": "PEPTIDE NAME",
      "alignment": "left",
      "autoFit": {
        "enabled": true,
        "baseFontSizePt": 5,
        "minFontSizePt": 3
      }
    },
    {
      "id": "product_descriptor",
      "layer": "product_layer",
      "type": "text",
      "x": 36.095,
      "y": 34.127,
      "width": 31.387,
      "height": 5.393,
      "baselineYPct": 37.879,
      "textAnchor": "start",
      "locked": false,
      "defaultPlaceholder": "PRODUCT DESCRIPTOR",
      "alignment": "left",
      "autoFit": {
        "enabled": false
      }
    },
    {
      "id": "product_strength",
      "layer": "product_layer",
      "type": "text",
      "x": 36.095,
      "y": 42.208,
      "width": 31.387,
      "height": 19.706,
      "baselineYPct": 55.916,
      "textAnchor": "start",
      "locked": false,
      "defaultPlaceholder": "00MG",
      "alignment": "left",
      "autoFit": {
        "enabled": false
      }
    },
    {
      "id": "product_concentration",
      "layer": "product_layer",
      "type": "text",
      "x": 36.095,
      "y": 60.75,
      "width": 15.694,
      "height": 6.016,
      "baselineYPct": 64.935,
      "textAnchor": "start",
      "locked": false,
      "defaultPlaceholder": "0MG/ML",
      "alignment": "left",
      "autoFit": {
        "enabled": false
      }
    },
    {
      "id": "product_vial_size",
      "layer": "product_layer",
      "type": "text",
      "x": 53.358,
      "y": 60.75,
      "width": 14.124,
      "height": 6.016,
      "baselineYPct": 64.935,
      "textAnchor": "start",
      "locked": false,
      "defaultPlaceholder": "0ML VIAL",
      "alignment": "left",
      "autoFit": {
        "enabled": false
      }
    },
    {
      "id": "purity_icon",
      "layer": "product_layer",
      "type": "use",
      "x": 36.095,
      "y": 68.543,
      "width": 2.511,
      "height": 5.772,
      "locked": false,
      "defaultPlaceholder": "#icon-purity",
      "alignment": null,
      "autoFit": {
        "enabled": false
      }
    },
    {
      "id": "purity_claim",
      "layer": "product_layer",
      "type": "text",
      "x": 39.47,
      "y": 69.769,
      "width": 28.013,
      "height": 6.016,
      "baselineYPct": 73.954,
      "textAnchor": "start",
      "locked": false,
      "defaultPlaceholder": "≥99% PURITY",
      "alignment": "left",
      "autoFit": {
        "enabled": false
      }
    },
    {
      "id": "lab_icon",
      "layer": "product_layer",
      "type": "use",
      "x": 36.095,
      "y": 77.561,
      "width": 2.511,
      "height": 5.772,
      "locked": false,
      "defaultPlaceholder": "#icon-lab-tested",
      "alignment": null,
      "autoFit": {
        "enabled": false
      }
    },
    {
      "id": "lab_claim",
      "layer": "product_layer",
      "type": "text",
      "x": 39.47,
      "y": 78.788,
      "width": 28.013,
      "height": 6.016,
      "baselineYPct": 82.973,
      "textAnchor": "start",
      "locked": false,
      "defaultPlaceholder": "LAB TESTED",
      "alignment": "left",
      "autoFit": {
        "enabled": false
      }
    },
    {
      "id": "country_icon",
      "layer": "verification_layer",
      "type": "use",
      "x": 71.798,
      "y": 10.823,
      "width": 4.394,
      "height": 10.101,
      "locked": false,
      "defaultPlaceholder": "#icon-origin",
      "alignment": null,
      "autoFit": {
        "enabled": false
      }
    },
    {
      "id": "coa_qr",
      "layer": "verification_layer",
      "type": "image",
      "x": 76.114,
      "y": 15.332,
      "width": 14.124,